{
  "format": "passage-reading/1",
  "title": "skill-prefs: the Description guidance",
  "made": "2026-10-14",
  "source": {
    "repo": "mehrlander/web-tools",
    "path": "skills/skill-prefs/SKILL.md",
    "note": "A newer draft of the guidance on writing a skill's description. The committed file holds an older, shorter Trigger bullet in its place."
  },
  "gist": "Defines a skill's description by the one decision it serves and the budget it lives under, draws the rules for writing it from those two facts, and closes with the exception for skills that are only summoned.",
  "topic": "description",
  "context": [
    {
      "id": "prefs",
      "repo": "mehrlander/web-tools",
      "path": "skills/skill-prefs/SKILL.md",
      "ref": "64eb998c",
      "why": "The document the passage belongs to, as committed. Its Trigger bullet is the older version of sentence 5."
    },
    {
      "id": "ie",
      "repo": "mehrlander/web-tools",
      "path": "skills/inspire-excellence/SKILL.md",
      "ref": "64eb998c",
      "why": "The skill sentence 5 cites as its cautionary case."
    }
  ],
  "entities": {
    "description": {
      "label": "description",
      "gloss": "The description value in a SKILL.md file's YAML frontmatter.",
      "basis": "context",
      "ctx": [{ "doc": "prefs", "quote": "description: \"Standing preferences for how a skill should be written." }]
    },
    "listing": {
      "label": "listing",
      "gloss": "The list of available skills, by name and description, that a session sees before loading any of them.",
      "basis": "passage"
    },
    "session": {
      "label": "session",
      "gloss": "One running conversation with the model.",
      "basis": "general"
    },
    "load-decision": {
      "label": "the decision about what to load",
      "gloss": "The session's choice of which skills to load for the request in front of it.",
      "basis": "passage"
    },
    "budget": {
      "label": "budget",
      "gloss": "A limit on how much text the listing can hold. The passage gives neither its size nor its unit.",
      "basis": "passage"
    },
    "situation": {
      "label": "the summoning situation",
      "gloss": "The kind of request or circumstance in which the skill should be used.",
      "basis": "passage"
    },
    "material": {
      "label": "material",
      "gloss": "What the skill produces when it runs. For inspire-excellence, the prompts it writes.",
      "basis": "passage"
    },
    "inspire-excellence": {
      "label": "inspire-excellence",
      "gloss": "A skill in the web-tools skill library that helps write high-ambition prompts. Its description says it triggers on any ask to write a prompt with conviction behind it.",
      "basis": "context",
      "ctx": [
        { "doc": "ie", "quote": "Helps construct a high-ambition prompt that hands over a standard and a direction rather than a feature spec." },
        { "doc": "ie", "quote": "Triggers include any ask to write a prompt with conviction behind it." }
      ]
    },
    "trigger": {
      "label": "trigger",
      "gloss": "The part of a description that says when to use the skill, which sentence 4 calls the situation that summons it. The committed version of this guidance is headed Trigger and states sentence 5's rule in nearly the same words.",
      "basis": "context",
      "ctx": [{ "doc": "prefs", "quote": "The trigger should name the situation that summons the skill, never the material it produces." }]
    },
    "boundary": {
      "label": "boundary",
      "gloss": "A clause in a description saying what the skill is not for and which skill to use instead.",
      "basis": "passage"
    },
    "body": {
      "label": "body",
      "gloss": "The SKILL.md text below the frontmatter, which a session reads only after loading the skill.",
      "basis": "passage"
    },
    "summoned-only": {
      "label": "summoned-only skill",
      "gloss": "A skill that runs only when a user calls it by name, never loaded on the model's own judgment.",
      "basis": "context",
      "ctx": [{ "doc": "prefs", "quote": "disable-model-invocation for summoned-only" }]
    },
    "disable-model-invocation": {
      "label": "disable-model-invocation",
      "gloss": "A frontmatter flag that declares a skill summoned-only.",
      "basis": "context",
      "ctx": [{ "doc": "prefs", "quote": "In Claude Code a skill can declare its mode in frontmatter" }]
    }
  },
  "lead": "Description.",
  "sentences": [
    {
      "n": 1,
      "text": "The description is the skill's entry in a listing a session scans to decide what to load.",
      "mentions": [
        { "e": "description", "quote": "The description" },
        { "e": "listing", "quote": "a listing" },
        { "e": "session", "quote": "a session" },
        { "e": "load-decision", "quote": "decide what to load" }
      ],
      "links": [],
      "atoms": [
        { "id": "a", "type": "definition", "claim": "A skill's description is its entry in the skill listing.", "quote": "the skill's entry in a listing", "on": ["description", "listing"] },
        { "id": "b", "type": "assertion", "claim": "A session scans the skill listing to decide which skills to load.", "quote": "a session scans to decide what to load", "on": ["session", "listing", "load-decision"] }
      ]
    },
    {
      "n": 2,
      "text": "The listing has a budget: past it, descriptions drop and names remain, least-used skills first.",
      "mentions": [
        { "e": "listing", "quote": "The listing", "form": "anaphor" },
        { "e": "budget", "quote": "a budget" },
        { "e": "budget", "quote": "past it", "form": "anaphor" },
        { "e": "description", "quote": "descriptions" }
      ],
      "links": [],
      "atoms": [
        { "id": "a", "type": "assertion", "claim": "The skill listing has a size budget.", "quote": "The listing has a budget", "on": ["listing", "budget"] },
        { "id": "b", "type": "assertion", "claim": "Once the listing exceeds its budget, skills lose their descriptions from it and keep only their names.", "quote": "descriptions drop and names remain", "on": ["listing", "budget", "description"] },
        { "id": "c", "type": "assertion", "claim": "The least-used skills lose their descriptions first.", "quote": "least-used skills first", "on": ["description"] }
      ]
    },
    {
      "n": 3,
      "text": "Write for that one decision.",
      "mentions": [
        { "e": "description", "quote": "Write", "form": "ellipsis", "slot": "object of Write", "fill": "the description" },
        { "e": "load-decision", "quote": "that one decision", "form": "anaphor" }
      ],
      "links": [],
      "atoms": [
        { "id": "a", "type": "rule", "claim": "Write a skill's description to serve a session's decision about which skills to load.", "quote": "Write for that one decision", "on": ["description", "load-decision"] },
        { "id": "b", "type": "rule", "claim": "A skill's description should serve no purpose other than the decision about what to load.", "quote": "one decision", "on": ["description", "load-decision"], "implied": true, "note": "The word 'one' makes the purpose exclusive. Sentence 7 relies on that exclusivity." }
      ]
    },
    {
      "n": 4,
      "text": "Lead with what the skill does, a verb and its object, then the situation that summons it, in the words a request would use: one or two phrases, not a list of synonyms.",
      "mentions": [
        { "e": "situation", "quote": "the situation that summons it" }
      ],
      "links": [
        { "to": 3, "kind": "elaborates", "here": "Lead with what the skill does", "there": "Write for that one decision", "implied": true, "gloss": "Says what writing for the decision about what to load means in practice: what goes first in the description, and what follows." }
      ],
      "atoms": [
        { "id": "a", "type": "rule", "claim": "Open a skill's description with what the skill does, as a verb and its object.", "quote": "Lead with what the skill does, a verb and its object", "on": ["description"] },
        { "id": "b", "type": "rule", "claim": "After what the skill does, the description states the situation in which the skill should be used.", "quote": "then the situation that summons it", "on": ["description", "situation"] },
        { "id": "c", "type": "rule", "claim": "The description states that situation in the words a user's request would use.", "quote": "in the words a request would use", "on": ["description", "situation"] },
        { "id": "d", "type": "rule", "claim": "The description gives that situation in one or two phrases, not a list of synonyms.", "quote": "one or two phrases, not a list of synonyms", "on": ["description", "situation"] }
      ]
    },
    {
      "n": 5,
      "text": "Name the situation, never the material the skill produces; inspire-excellence is the cautionary case, a trigger built from the vocabulary of its own prompts that fired on its own output.",
      "mentions": [
        { "e": "situation", "quote": "the situation", "form": "anaphor" },
        { "e": "material", "quote": "the material the skill produces" },
        { "e": "inspire-excellence", "quote": "inspire-excellence" },
        { "e": "trigger", "quote": "a trigger" },
        { "e": "inspire-excellence", "quote": "its", "in": "its own prompts", "form": "anaphor", "note": "'its' is inspire-excellence, not the trigger: the prompts are what the skill writes." },
        { "e": "material", "quote": "its own prompts" },
        { "e": "trigger", "quote": "that fired", "form": "anaphor", "note": "'that' attaches to the trigger, not to the prompts: the trigger is what fired." },
        { "e": "inspire-excellence", "quote": "its", "in": "its own output", "form": "anaphor" },
        { "e": "material", "quote": "its own output" }
      ],
      "links": [],
      "atoms": [